[
  {
    "asset_id": "asset_tk101",
    "tag": "TK-101",
    "name": "Crude Storage Tank",
    "type": "storage_tank",
    "facility_id": "demo_refinery",
    "area_id": "area_100",
    "unit_id": "unit_crude",
    "service": "crude_storage",
    "status": "online",
    "model_ref": "TK-101",
    "position": {
      "x": 0,
      "y": 0,
      "z": 0
    },
    "rotation": {
      "x": 0,
      "y": 0,
      "z": 0
    },
    "dimensions": {
      "height": 16.2,
      "length": 8,
      "width": 4,
      "diameter": 28
    },
    "interactive": true,
    "synthetic": true
  },
  {
    "asset_id": "asset_p101a",
    "tag": "P-101A",
    "name": "Crude Transfer Pump A",
    "type": "pump",
    "facility_id": "demo_refinery",
    "area_id": "area_100",
    "unit_id": "unit_crude",
    "service": "crude_transfer",
    "status": "online",
    "model_ref": "P-101A",
    "position": {
      "x": 24,
      "y": 3,
      "z": 0
    },
    "rotation": {
      "x": 0,
      "y": 0,
      "z": 0
    },
    "interactive": true,
    "synthetic": true,
    "dimensions": {
      "height": 2,
      "length": 5,
      "width": 2,
      "diameter": 3
    }
  },
  {
    "asset_id": "asset_p101b",
    "tag": "P-101B",
    "name": "Crude Transfer Pump B",
    "type": "pump",
    "facility_id": "demo_refinery",
    "area_id": "area_100",
    "unit_id": "unit_crude",
    "service": "crude_transfer",
    "status": "standby",
    "model_ref": "P-101B",
    "position": {
      "x": 24,
      "y": 7,
      "z": 0
    },
    "rotation": {
      "x": 0,
      "y": 0,
      "z": 0
    },
    "interactive": true,
    "synthetic": true,
    "dimensions": {
      "height": 2,
      "length": 5,
      "width": 2,
      "diameter": 3
    }
  },
  {
    "asset_id": "asset_e201",
    "tag": "E-201",
    "name": "Crude Preheat Exchanger",
    "type": "heat_exchanger",
    "facility_id": "demo_refinery",
    "area_id": "area_200",
    "unit_id": "unit_cdu",
    "service": "crude_preheat",
    "status": "online",
    "model_ref": "E-201",
    "position": {
      "x": 48,
      "y": 14,
      "z": 1.2
    },
    "rotation": {
      "x": 0,
      "y": 0,
      "z": 0
    },
    "dimensions": {
      "height": 6,
      "length": 10,
      "width": 4,
      "diameter": 2.5
    },
    "interactive": true,
    "synthetic": true
  },
  {
    "asset_id": "asset_f201",
    "tag": "F-201",
    "name": "Crude Fired Heater",
    "type": "fired_heater",
    "facility_id": "demo_refinery",
    "area_id": "area_200",
    "unit_id": "unit_cdu",
    "service": "crude_heating",
    "status": "online",
    "model_ref": "F-201",
    "position": {
      "x": 79,
      "y": 14,
      "z": 0
    },
    "rotation": {
      "x": 0,
      "y": 0,
      "z": 0
    },
    "dimensions": {
      "height": 18,
      "length": 14,
      "width": 10,
      "diameter": 3
    },
    "interactive": true,
    "synthetic": true
  },
  {
    "asset_id": "asset_t201",
    "tag": "T-201",
    "name": "Atmospheric Distillation Column",
    "type": "column",
    "facility_id": "demo_refinery",
    "area_id": "area_200",
    "unit_id": "unit_cdu",
    "service": "crude_fractionation",
    "status": "online",
    "model_ref": "T-201",
    "position": {
      "x": 102,
      "y": 23,
      "z": 0
    },
    "rotation": {
      "x": 0,
      "y": 0,
      "z": 0
    },
    "dimensions": {
      "height": 44,
      "length": 8,
      "width": 4,
      "diameter": 6
    },
    "interactive": true,
    "synthetic": true
  },
  {
    "asset_id": "asset_v202",
    "tag": "V-202",
    "name": "Overhead Receiver",
    "type": "vessel",
    "facility_id": "demo_refinery",
    "area_id": "area_200",
    "unit_id": "unit_cdu",
    "service": "overhead_separation",
    "status": "online",
    "model_ref": "V-202",
    "position": {
      "x": 116,
      "y": 23,
      "z": 5
    },
    "rotation": {
      "x": 0,
      "y": 0,
      "z": 0
    },
    "interactive": true,
    "synthetic": true,
    "dimensions": {
      "height": 6,
      "length": 8,
      "width": 4,
      "diameter": 3
    }
  },
  {
    "asset_id": "asset_tk301",
    "tag": "TK-301",
    "name": "Diesel Product Tank",
    "type": "storage_tank",
    "facility_id": "demo_refinery",
    "area_id": "area_500",
    "unit_id": "unit_products",
    "service": "diesel_storage",
    "status": "online",
    "model_ref": "TK-301",
    "position": {
      "x": 150,
      "y": 12,
      "z": 0
    },
    "rotation": {
      "x": 0,
      "y": 0,
      "z": 0
    },
    "dimensions": {
      "height": 14.4,
      "length": 8,
      "width": 4,
      "diameter": 24
    },
    "interactive": true,
    "synthetic": true
  },
  {
    "asset_id": "asset_fl401",
    "tag": "FL-401",
    "name": "Flare Stack",
    "type": "flare",
    "facility_id": "demo_refinery",
    "area_id": "area_400",
    "unit_id": "unit_utilities",
    "service": "relief",
    "status": "online",
    "model_ref": "FL-401",
    "position": {
      "x": 170,
      "y": 55,
      "z": 0
    },
    "rotation": {
      "x": 0,
      "y": 0,
      "z": 0
    },
    "dimensions": {
      "height": 65,
      "length": 8,
      "width": 4,
      "diameter": 3
    },
    "interactive": true,
    "synthetic": true
  },
  {
    "asset_id": "asset_tk102",
    "tag": "TK-102",
    "name": "Crude Storage Tank B",
    "type": "storage_tank",
    "facility_id": "demo_refinery",
    "area_id": "area_100",
    "unit_id": "unit_crude",
    "service": "crude_storage_tank_b",
    "status": "online",
    "model_ref": "TK-102",
    "position": {
      "x": 0,
      "y": 38,
      "z": 0
    },
    "rotation": {
      "x": 0,
      "y": 0,
      "z": 0
    },
    "dimensions": {
      "height": 16.2,
      "length": 8,
      "width": 4,
      "diameter": 28
    },
    "interactive": true,
    "synthetic": true
  },
  {
    "asset_id": "asset_e202",
    "tag": "E-202",
    "name": "Second Preheat Exchanger",
    "type": "heat_exchanger",
    "facility_id": "demo_refinery",
    "area_id": "area_200",
    "unit_id": "unit_cdu",
    "service": "second_preheat_exchanger",
    "status": "online",
    "model_ref": "E-202",
    "position": {
      "x": 61,
      "y": 14,
      "z": 0
    },
    "rotation": {
      "x": 0,
      "y": 0,
      "z": 0
    },
    "dimensions": {
      "height": 6,
      "length": 12,
      "width": 4,
      "diameter": 3
    },
    "interactive": true,
    "synthetic": true
  },
  {
    "asset_id": "asset_e203",
    "tag": "E-203",
    "name": "Overhead Condenser",
    "type": "heat_exchanger",
    "facility_id": "demo_refinery",
    "area_id": "area_200",
    "unit_id": "unit_cdu",
    "service": "overhead_condenser",
    "status": "online",
    "model_ref": "E-203",
    "position": {
      "x": 111,
      "y": 43,
      "z": 0
    },
    "rotation": {
      "x": 0,
      "y": 0,
      "z": 0
    },
    "dimensions": {
      "height": 6,
      "length": 12,
      "width": 4,
      "diameter": 3
    },
    "interactive": true,
    "synthetic": true
  },
  {
    "asset_id": "asset_v203",
    "tag": "V-203",
    "name": "Reflux Drum",
    "type": "vessel",
    "facility_id": "demo_refinery",
    "area_id": "area_200",
    "unit_id": "unit_cdu",
    "service": "reflux_drum",
    "status": "online",
    "model_ref": "V-203",
    "position": {
      "x": 125,
      "y": 43,
      "z": 0
    },
    "rotation": {
      "x": 0,
      "y": 0,
      "z": 0
    },
    "dimensions": {
      "height": 10,
      "length": 8,
      "width": 4,
      "diameter": 4
    },
    "interactive": true,
    "synthetic": true
  },
  {
    "asset_id": "asset_t302",
    "tag": "T-302",
    "name": "Product Stabilizer",
    "type": "column",
    "facility_id": "demo_refinery",
    "area_id": "area_500",
    "unit_id": "unit_products",
    "service": "product_stabilizer",
    "status": "online",
    "model_ref": "T-302",
    "position": {
      "x": 133,
      "y": 19,
      "z": 0
    },
    "rotation": {
      "x": 0,
      "y": 0,
      "z": 0
    },
    "dimensions": {
      "height": 24,
      "length": 8,
      "width": 4,
      "diameter": 3
    },
    "interactive": true,
    "synthetic": true
  },
  {
    "asset_id": "asset_tk302",
    "tag": "TK-302",
    "name": "Naphtha Product Tank",
    "type": "storage_tank",
    "facility_id": "demo_refinery",
    "area_id": "area_500",
    "unit_id": "unit_products",
    "service": "naphtha_product_tank",
    "status": "online",
    "model_ref": "TK-302",
    "position": {
      "x": 150,
      "y": -20,
      "z": 0
    },
    "rotation": {
      "x": 0,
      "y": 0,
      "z": 0
    },
    "dimensions": {
      "height": 12.6,
      "length": 8,
      "width": 4,
      "diameter": 22
    },
    "interactive": false,
    "synthetic": true
  },
  {
    "asset_id": "asset_tk303",
    "tag": "TK-303",
    "name": "Kerosene Product Tank",
    "type": "storage_tank",
    "facility_id": "demo_refinery",
    "area_id": "area_500",
    "unit_id": "unit_products",
    "service": "kerosene_product_tank",
    "status": "online",
    "model_ref": "TK-303",
    "position": {
      "x": 178,
      "y": 12,
      "z": 0
    },
    "rotation": {
      "x": 0,
      "y": 0,
      "z": 0
    },
    "dimensions": {
      "height": 12.6,
      "length": 8,
      "width": 4,
      "diameter": 22
    },
    "interactive": false,
    "synthetic": true
  },
  {
    "asset_id": "asset_tk304",
    "tag": "TK-304",
    "name": "Residue Product Tank",
    "type": "storage_tank",
    "facility_id": "demo_refinery",
    "area_id": "area_500",
    "unit_id": "unit_products",
    "service": "residue_product_tank",
    "status": "online",
    "model_ref": "TK-304",
    "position": {
      "x": 178,
      "y": -20,
      "z": 0
    },
    "rotation": {
      "x": 0,
      "y": 0,
      "z": 0
    },
    "dimensions": {
      "height": 10.8,
      "length": 8,
      "width": 4,
      "diameter": 22
    },
    "interactive": false,
    "synthetic": true
  },
  {
    "asset_id": "asset_p301",